{
  "contract": "build-audit-handoff",
  "version": 2,
  "task_id": "moving-average",
  "build_revision": 0,
  "spec": "Implement a Python function that returns the arithmetic means of complete sliding windows.",
  "acceptance_criteria": [
    "Empty input with a positive window returns an empty list.",
    "A window larger than the input returns an empty list.",
    "Each result is the mean of exactly one complete window.",
    "A non-positive or non-integer window raises ValueError."
  ],
  "artifacts": [
    {
      "path": "moving_average.py",
      "status": "new",
      "lines_changed": 8,
      "summary": "Adds the function and boundary checks.",
      "snapshot_included": true
    }
  ],
  "context_manifest": [],
  "verification": [
    {
      "check": "Boundary and sliding-window tests",
      "command": "pytest -q",
      "result": "not-run",
      "environment": "not_run",
      "evidence": "Project test runner and files were not available in the agent sandbox."
    }
  ],
  "self_audit": [],
  "assumptions": [],
  "flags": [],
  "open_questions": [],
  "base_revision": "unknown",
  "confidence": "medium"
}